{
  "$schema": "../../../../schemas/section_manifest.schema.json",
  "schema_version": "1.0.0",
  "content_version": "1.0.0",
  "module_id": "physics",
  "section_id": "optics",
  "title": "Optics",
  "description": "Introduction to light, reflection, and how rays behave.",
  "packages": [
    {
      "package_id": "page_001",
      "title": "Optics Page 001",
      "manifest_path": "packages/page_001/package_manifest.json",
      "order": 1
    }
  ]
}
